{"schema":"ores.otel.log/test-org-matrix/v1","targetOrganization":"ores-otel-test","policy":{"minimumRepositories":10,"minimumLanguages":7,"requiredTracks":["legacy","canonical"],"applyRequiresExactRefs":true,"productionWritesAllowed":false},"tracks":[{"id":"legacy","repository":"ORESoftware/next-loggers.ts","ref":"b83c026fd4cbc19173406c67d2abf979385832b6","status":"ready"},{"id":"canonical","repository":"ores-otel/ores.otel.log","ref":null,"status":"blocked","blockedBy":"canonical-repository-not-created"}],"repositories":[{"name":"legacy-nodejs-consumer","language":"nodejs","runtimeFamily":"nodejs","track":"legacy","visibility":"private","sourcePath":"sdk/nodejs","package":"@oresoftware/next-loggers","testCommand":"npm test","requiredChecks":["contract","consumer"]},{"name":"canonical-nodejs-consumer","language":"nodejs","runtimeFamily":"nodejs","track":"canonical","visibility":"private","sourcePath":"sdk/nodejs","package":"@oresoftware/next-loggers","testCommand":"npm test","requiredChecks":["contract","consumer"]},{"name":"legacy-python-consumer","language":"python","runtimeFamily":"python","track":"legacy","visibility":"private","sourcePath":"sdk/python","package":"oresoftware-next-loggers","testCommand":"python -m unittest discover -s tests -v","requiredChecks":["contract","consumer"]},{"name":"canonical-python-consumer","language":"python","runtimeFamily":"python","track":"canonical","visibility":"private","sourcePath":"sdk/python","package":"oresoftware-next-loggers","testCommand":"python -m unittest discover -s tests -v","requiredChecks":["contract","consumer"]},{"name":"legacy-go-consumer","language":"go","runtimeFamily":"go","track":"legacy","visibility":"private","sourcePath":"sdk/go","package":"github.com/ores-otel/ores.otel.log/sdk/go","testCommand":"go test ./...","requiredChecks":["contract","consumer"]},{"name":"canonical-go-consumer","language":"go","runtimeFamily":"go","track":"canonical","visibility":"private","sourcePath":"sdk/go","package":"github.com/ores-otel/ores.otel.log/sdk/go","testCommand":"go test ./...","requiredChecks":["contract","consumer"]},{"name":"legacy-rust-consumer","language":"rust","runtimeFamily":"rust","track":"legacy","visibility":"private","sourcePath":"sdk/rust","package":"oresoftware-next-loggers","testCommand":"cargo test --locked","requiredChecks":["contract","consumer"]},{"name":"canonical-rust-consumer","language":"rust","runtimeFamily":"rust","track":"canonical","visibility":"private","sourcePath":"sdk/rust","package":"oresoftware-next-loggers","testCommand":"cargo test --locked","requiredChecks":["contract","consumer"]},{"name":"legacy-java-consumer","language":"java","runtimeFamily":"jvm","track":"legacy","visibility":"private","sourcePath":"sdk/java","package":"io.github.oresoftware:next-loggers","testCommand":"bash test.sh","requiredChecks":["contract","consumer"]},{"name":"canonical-java-consumer","language":"java","runtimeFamily":"jvm","track":"canonical","visibility":"private","sourcePath":"sdk/java","package":"io.github.oresoftware:next-loggers","testCommand":"bash test.sh","requiredChecks":["contract","consumer"]},{"name":"legacy-dart-consumer","language":"dart","runtimeFamily":"dart","track":"legacy","visibility":"private","sourcePath":"sdk/dart","package":"oresoftware_next_loggers","testCommand":"dart run test/conformance.dart","requiredChecks":["contract","consumer"]},{"name":"canonical-dart-consumer","language":"dart","runtimeFamily":"dart","track":"canonical","visibility":"private","sourcePath":"sdk/dart","package":"oresoftware_next_loggers","testCommand":"dart run test/conformance.dart","requiredChecks":["contract","consumer"]},{"name":"legacy-ruby-consumer","language":"ruby","runtimeFamily":"ruby","track":"legacy","visibility":"private","sourcePath":"sdk/ruby","package":"oresoftware-next-loggers","testCommand":"ruby test/next_loggers_test.rb","requiredChecks":["contract","consumer"]},{"name":"canonical-ruby-consumer","language":"ruby","runtimeFamily":"ruby","track":"canonical","visibility":"private","sourcePath":"sdk/ruby","package":"oresoftware-next-loggers","testCommand":"ruby test/next_loggers_test.rb","requiredChecks":["contract","consumer"]},{"name":"legacy-gleam-consumer","language":"gleam","runtimeFamily":"beam","track":"legacy","visibility":"private","sourcePath":"sdk/gleam","package":"oresoftware_next_loggers","testCommand":"gleam test","requiredChecks":["contract","consumer"]},{"name":"canonical-gleam-consumer","language":"gleam","runtimeFamily":"beam","track":"canonical","visibility":"private","sourcePath":"sdk/gleam","package":"oresoftware_next_loggers","testCommand":"gleam test","requiredChecks":["contract","consumer"]},{"name":"legacy-erlang-consumer","language":"erlang","runtimeFamily":"beam","track":"legacy","visibility":"private","sourcePath":"sdk/erlang","package":"oresoftware_next_loggers_erlang","testCommand":"bash test.sh","requiredChecks":["contract","consumer"]},{"name":"canonical-erlang-consumer","language":"erlang","runtimeFamily":"beam","track":"canonical","visibility":"private","sourcePath":"sdk/erlang","package":"oresoftware_next_loggers_erlang","testCommand":"bash test.sh","requiredChecks":["contract","consumer"]},{"name":"legacy-elixir-consumer","language":"elixir","runtimeFamily":"beam","track":"legacy","visibility":"private","sourcePath":"sdk/elixir","package":"oresoftware_next_loggers","testCommand":"bash test.sh","requiredChecks":["contract","consumer"]},{"name":"canonical-elixir-consumer","language":"elixir","runtimeFamily":"beam","track":"canonical","visibility":"private","sourcePath":"sdk/elixir","package":"oresoftware_next_loggers","testCommand":"bash test.sh","requiredChecks":["contract","consumer"]},{"name":"legacy-wasm-consumer","language":"wasm","runtimeFamily":"wasm","track":"legacy","visibility":"private","sourcePath":"sdk/wasm","package":"oresoftware-next-loggers-wasm","testCommand":"bash test.sh","requiredChecks":["contract","consumer"]},{"name":"canonical-wasm-consumer","language":"wasm","runtimeFamily":"wasm","track":"canonical","visibility":"private","sourcePath":"sdk/wasm","package":"oresoftware-next-loggers-wasm","testCommand":"bash test.sh","requiredChecks":["contract","consumer"]}]}
